{
  "vistas": {
    "frente": {"imagem": "preparo/frente-grade.png", "celulas_largura": 24, "celulas_altura": 32},
    "lado": {"imagem": "preparo/lado-grade.png", "celulas_largura": 40, "celulas_altura": 32}
  },
  "partes": [
    {"id": "body", "pai": null, "tipo": "volume", "simetria": "central", "caixas": {"frente": [6, 14, 18, 26], "lado": [10, 14, 30, 26]}, "papel_cor": "primaria"},
    {"id": "head", "pai": "body", "tipo": "volume", "simetria": "central", "caixas": {"frente": [4, 0, 20, 14], "lado": [2, 0, 16, 14]}, "papel_cor": "primaria"},
    {"id": "ear_left", "pai": "head", "tipo": "plano", "simetria": "esquerda", "espelho": "ear_right", "caixas": {"frente": [16, -4, 20, 1]}, "papel_cor": "primaria"},
    {"id": "tail", "pai": "body", "tipo": "volume", "simetria": "central", "caixas": {"lado": [30, 10, 40, 18]}, "rotacao_repouso": [-30, 0, 0], "segmentos": 2, "papel_cor": "primaria"}
  ],
  "papeis_cor": {"primaria": "#e0682a", "barriga": "#f4dcb8"},
  "incertezas": [{"parte": "tail", "item": "grossura", "resolucao": "prompt", "nota": "cauda escondida na frente"}]
}
